{
  "schema": "repository-harness-baseline-result/v2",
  "pilot_id": "e-inna-brain-phase5-baseline",
  "run_kind": "baseline",
  "evaluation_subject": {
    "kind": "pre-candidate-baseline",
    "identity": "e-inna-brain-repository-native-harness@9be2b9b624f29c2c4f93bb576485fd8de2085af4",
    "artifact": "evaluation-subject.json",
    "sha256": "16f6436496aa5c6cbe6e4d516275ec55dc8423e8b3a65c23be83c24d91b834b8"
  },
  "started_at": "2026-07-18T06:42:48Z",
  "completed_at": "2026-07-18T07:17:47Z",
  "starting_revision": "9be2b9b624f29c2c4f93bb576485fd8de2085af4",
  "card_set_sha256": "678e00b103bf32dc6fbdd6617bba7eda710e65cdb1bf43b69467cff594f0a594",
  "environment_sha256": "1a2c1145670897c3d85a0fb9509704f3b70174a38fd0a6ae69e38d0b9f3c1f15",
  "cards": [
    {
      "card_id": "P0",
      "outcome": "failed",
      "acceptance_command": "{\"argv\":[\"git\",\"diff\",\"--check\"]}",
      "evidence": [
        {
          "requirement": "Exact subject identity and command transcript.",
          "artifact": "P0/transcript.md"
        },
        {
          "requirement": "Path mapping and target-owned before/after SHA-256 report.",
          "artifact": "P0/role-map.json"
        },
        {
          "requirement": "Manifest, status, and audit outputs with exit codes.",
          "artifact": "P0/transcript.md"
        }
      ]
    },
    {
      "card_id": "P1",
      "outcome": "failed",
      "acceptance_command": "{\"argv\":[\"git\",\"diff\",\"--check\"]}",
      "evidence": [
        {
          "requirement": "Eligibility finding for P1.",
          "artifact": "P1/eligibility-finding.md"
        },
        {
          "requirement": "Source before/after digests and archive/export/receipt identities when eligible.",
          "artifact": "P1/source-digests.json"
        },
        {
          "requirement": "Kill-point transcript or signed inapplicability finding.",
          "artifact": "P1/eligibility-finding.md"
        }
      ]
    },
    {
      "card_id": "P2",
      "outcome": "passed",
      "acceptance_command": "{\"argv\":[\"pnpm\",\"test:architecture\"]}",
      "evidence": [
        {
          "requirement": "Prompt and ordered command transcript with exit codes.",
          "artifact": "P2/transcript.md"
        },
        {
          "requirement": "Core-command count computed from the transcript.",
          "artifact": "P2/ordinary-task.json"
        },
        {
          "requirement": "Target-native acceptance output and changed-path list.",
          "artifact": "P2/transcript.md"
        }
      ]
    },
    {
      "card_id": "P3",
      "outcome": "failed",
      "acceptance_command": "{\"argv\":[\"pnpm\",\"exec\",\"vitest\",\"run\",\"test/operational-metadata-adapter.spec.ts\",\"test/chat-contract.spec.ts\",\"test/mock-integration.spec.ts\"]}",
      "evidence": [
        {
          "requirement": "Fixed interruption point and both agent transcripts.",
          "artifact": "P3/transcripts.md"
        },
        {
          "requirement": "Durable plan before and after resumption.",
          "artifact": "P3/resume-plan.md"
        },
        {
          "requirement": "Environment digest and final target-native proof.",
          "artifact": "P3/validation-report.md"
        }
      ]
    },
    {
      "card_id": "P4",
      "outcome": "passed",
      "acceptance_command": "{\"argv\":[\"pnpm\",\"test:architecture\"]}",
      "evidence": [
        {
          "requirement": "Seed digest and failing output.",
          "artifact": "P4/seed-digest.json"
        },
        {
          "requirement": "Repair diff and passing output from the identical command.",
          "artifact": "P4/repair.diff"
        },
        {
          "requirement": "Intervention events including any correction relay.",
          "artifact": "interventions.json"
        }
      ]
    },
    {
      "card_id": "P5",
      "outcome": "passed",
      "acceptance_command": "{\"argv\":[\"pnpm\",\"typecheck\"]}",
      "evidence": [
        {
          "requirement": "Clean revision and seed identity.",
          "artifact": "P5/seed-identity.json"
        },
        {
          "requirement": "Feedback commands or captured target-owned feedback with timestamps.",
          "artifact": "P5/transcript.md"
        },
        {
          "requirement": "Final acceptance output and intervention log.",
          "artifact": "P5/transcript.md"
        }
      ]
    },
    {
      "card_id": "P6",
      "outcome": "failed",
      "acceptance_command": "{\"argv\":[\"pnpm\",\"test:architecture\"]}",
      "evidence": [
        {
          "requirement": "Repeated-correction evidence and durable capability diff.",
          "artifact": "P6/repeated-correction.md"
        },
        {
          "requirement": "Held-out prompt and fresh-agent transcript.",
          "artifact": "P6/held-out-transcript.md"
        },
        {
          "requirement": "Discovery path, environment digest, and target acceptance output.",
          "artifact": "P6/held-out-transcript.md"
        }
      ]
    },
    {
      "card_id": "P7",
      "outcome": "passed",
      "acceptance_command": "{\"argv\":[\"pnpm\",\"exec\",\"prettier\",\"--check\",\"docs/evidence/phase5-pilot-einna/P7/garden-fixture.json\"]}",
      "evidence": [
        {
          "requirement": "Bounded scope, trigger, and two run transcripts.",
          "artifact": "P7/transcript.md"
        },
        {
          "requirement": "Before/after path and digest inventories for both runs.",
          "artifact": "P7/digests.json"
        },
        {
          "requirement": "Target validation and gardening-review interventions.",
          "artifact": "interventions.json"
        }
      ]
    }
  ],
  "intervention_log": "interventions.json",
  "intervention_log_sha256": "8b8b7d994a06e69b6de3546dacfeff8826491ad209ab4aa79148196e7c75c0b3",
  "result_sha256": "48925d74f9ddf98c6a830a8660bb13cf230238058db8004f32a02d2a09794cfc"
}
